name,tier,region,website,best_contact_email,best_contact_role,why_target,notes,phone
University of Washington Soccer (Huskies),ncaa-mens,Seattle WA,https://gohuskies.com/,info@gohuskies.com,Athletics Communications,Top Pac-12 / Big Ten program; Seattle WC2026 host market; Sounders alumni pipeline,Graves Building Seattle WA 98195,+1 206 543 2230
Marquette University Soccer (Golden Eagles),ncaa-mens,Milwaukee WI,https://gomarquette.com/,info@gomarquette.com,Athletics Communications,Big East men's top program; Milwaukee market without MLS,1212 W Wisconsin Ave Milwaukee WI 53201,+1 414 288 6303
SUM (Soccer United Marketing),federation-national,New York NY,https://www.mlssoccer.com/sum,info@mlssoccer.com,Commercial Office,Commercial arm of MLS that also markets USMNT + Liga MX in the US; central node for any US-football-marketing partnership,Same address as MLS HQ; consider as MLS press routing,
American Outlaws (USMNT supporters),supporters-trust,Lincoln NE,https://www.theamericanoutlaws.com/,info@theamericanoutlaws.com,General Inbox,~30K members in 200+ chapters supporting USMNT; the single largest US national-team supporters club; perfect WC2026 channel,Founded 2007 in Lincoln NE; co-founder Korey Donahoo; chapter network covers all 50 states,
The Yellow Wall (chapter network),supporters-trust,Multi-city,https://www.borussiadortmund-fanclubs.com/,info@bvb.de,Supporters Network,Largest BVB Dortmund fan-club network outside Germany lives in the US; perfect for German + Mundial 2026 angle,Routes via BVB official fan-club desk,
DC Statesmen + ENGland Members Club,supporters-trust,Multi-city,https://www.englandsupportersclub.com/,enquiries@thefa.com,General Inbox,US chapters of the official England supporters club; useful WC2026 EN-fan-engagement angle in DC + NYC + LA,Reach via The FA central registry,
Local Initiative AUSA (Association of US Soccer Coaches state chapters),federation-state-youth,national,https://unitedsoccercoaches.org/,info@unitedsoccercoaches.org,General Inbox,United Soccer Coaches state-chapter network (Texas Florida California etc) - same parent body as the national org above; chapter routing makes state-specific outreach more direct,Routes via main Kansas City office,
NSCAA Foundation (now United Soccer Coaches Foundation),federation-national,Kansas City MO,https://unitedsoccercoaches.org/,foundation@unitedsoccercoaches.org,Foundation Office,Charitable arm of the coaches association; coaching-education channel into the WC2026 community-engagement narrative,30 W Pershing Rd Suite 350 Kansas City MO 64108,
USL Player Association,federation-national,national,https://uslplayers.org/,info@uslplayers.org,Executive Office,Player union covering all USL Championship + League One players; co-signal moves locker rooms,Founded 2022; Director Andrew Wiebe (unverified),
US Adult Soccer Cosmopolitan League (NY),federation-state-youth,New York NY,https://www.cosmopolitansoccerleague.org/,info@cosmopolitansoccerleague.org,General Inbox,One of the oldest adult amateur leagues in the US (1923); strong NYC ethnic-community clubs (Polish German Greek Italian Hispanic); WC2026 NY metro overlap,Affiliated with USASA via ENYSSA,
Maryland Major Soccer League,federation-state-youth,Baltimore MD,https://www.marylandmajor.com/,info@marylandmajor.com,General Inbox,Largest adult amateur league in MD/DC; 50+ clubs; WC2026 DC market overlap,Spring + Fall seasons; affiliated USASA,
Cosmos League (Long Island NY),federation-state-youth,Long Island NY,https://www.licsleague.com/,info@licsleague.com,General Inbox,Long Island adult amateur league; ethnic-community clubs; WC2026 NY/NJ host overlap,LICSL is the Long Island Cosmopolitan Soccer League,
